{"delivery_export_result_id":"delivery-export-result-demo-0001","schema_version":"1.0.0","tenant_id":"tenant-demo","project_id":"project-demo","delivery_export_request_id":"delivery-export-request-demo-0001","export_id":"delivery-export-demo-0001","delivery_package_id":"delivery-package-demo-0001","source_snapshot_revision":3,"replay_state":"created","export_path":"exports/demo-checkpoint-r1","zip_path":"exports/demo-checkpoint-r1.zip","package_sha256":"aaaaaaaaaaaaaaaaaaaaaaaaaaaaaaaaaaaaaaaaaaaaaaaaaaaaaaaaaaaaaaaa","zip_sha256":"bbbbbbbbbbbbbbbbbbbbbbbbbbbbbbbbbbbbbbbbbbbbbbbbbbbbbbbbbbbbbbbb","zip_size_bytes":1024,"delivery_manifest":{"manifest_id":"delivery-package-demo-0001","relative_path":"exports/demo-checkpoint-r1/export-manifest.json","content_sha256":"cccccccccccccccccccccccccccccccccccccccccccccccccccccccccccccccc"},"role_handoff_manifests":[{"manifest_id":"role-handoff-demo-0001","relative_path":"exports/demo-checkpoint-r1/project-management/manifest.json","content_sha256":"dddddddddddddddddddddddddddddddddddddddddddddddddddddddddddddddd"}],"notion_import_manifest":{"manifest_id":"notion-import-demo-0001","relative_path":"exports/demo-checkpoint-r1/notion-import/manifest.json","content_sha256":"eeeeeeeeeeeeeeeeeeeeeeeeeeeeeeeeeeeeeeeeeeeeeeeeeeeeeeeeeeeeeeee"},"created_at":"2026-08-20T10:00:00Z"}
